{
  "additional_evidence_needed": [
    "a control-plane F-TEID or TEID continuity observation for the unresolved hop",
    "a reviewed S1AP/GTPv2 identity bridge before any Attach-to-session association is attempted",
    "an independently justified SGW-C identity observation before any S11-to-S5/S8 association"
  ],
  "ambiguous_evidence": [],
  "analysis_scope": "epc-session-control",
  "bearer_context_observations": [
    {
      "bearer_contexts": [
        {
          "binding_basis": "pdml_grouped_ie",
          "cause": {
            "cause_code": 16,
            "cause_name": "Request accepted",
            "scope": "bearer"
          },
          "charging_id_present": true,
          "ebi": 5,
          "f_teids": [
            {
              "interface_type": 1,
              "interface_type_name": "S1-U SGW GTP-U interface",
              "scope": "bearer",
              "teid": 49676
            },
            {
              "interface_type": 5,
              "interface_type_name": "S5/S8 PGW GTP-U interface",
              "scope": "bearer",
              "teid": 14081
            }
          ],
          "item_index": 0,
          "scope": "bearer"
        }
      ],
      "frame_number": 22,
      "transaction_reference": "gtpv2-create-session-19-27"
    },
    {
      "bearer_contexts": [
        {
          "binding_basis": "pdml_grouped_ie",
          "cause": {
            "cause_code": 16,
            "cause_name": "Request accepted",
            "scope": "bearer"
          },
          "charging_id_present": true,
          "ebi": 5,
          "f_teids": [
            {
              "interface_type": 5,
              "interface_type_name": "S5/S8 PGW GTP-U interface",
              "scope": "bearer",
              "teid": 14081
            }
          ],
          "item_index": 0,
          "scope": "bearer"
        }
      ],
      "frame_number": 21,
      "transaction_reference": "gtpv2-create-session-20-13"
    },
    {
      "bearer_contexts": [
        {
          "binding_basis": "pdml_grouped_ie",
          "cause": {
            "cause_code": 16,
            "cause_name": "Request accepted",
            "scope": "bearer"
          },
          "charging_id_present": false,
          "ebi": 5,
          "f_teids": [
            {
              "interface_type": 0,
              "interface_type_name": "S1-U eNodeB GTP-U interface",
              "scope": "bearer",
              "teid": 3355633680
            }
          ],
          "item_index": 0,
          "scope": "bearer"
        }
      ],
      "frame_number": 29,
      "transaction_reference": "gtpv2-modify-bearer-27-28"
    }
  ],
  "boundary_selection_status": "NOT_EVALUATED",
  "control_plane_subject_count": 4,
  "control_plane_subjects": [
    {
      "association_strength": "UNBOUND",
      "attach_association": "NOT_ESTABLISHED",
      "bearer_contexts": [],
      "capture_file": "corenet-epc-integrated.pcap",
      "control_plane_teids": [],
      "cross_interface_association": "NOT_ESTABLISHED",
      "endpoint_pair": "127.0.0.2:2123->127.0.0.3:2123",
      "evidence_refs": [
        {
          "evidence_level": "OBSERVED",
          "frame_number": 10,
          "message_type": "Delete Session Request",
          "message_type_code": 36,
          "protocol": "GTPv2-C"
        },
        {
          "evidence_level": "OBSERVED",
          "frame_number": 14,
          "message_type": "Delete Session Response",
          "message_type_code": 37,
          "protocol": "GTPv2-C"
        }
      ],
      "evidence_refs_omitted": 0,
      "f_teid_evidence": [],
      "interface": "UNKNOWN_INTERFACE",
      "interface_evidence": {
        "basis": "unavailable",
        "evidence_message": null,
        "interface": "UNKNOWN_INTERFACE",
        "supporting_frames": [],
        "supporting_interface_types": []
      },
      "interface_label": "unresolved control-plane hop",
      "limitations": [
        "no reviewed control-plane F-TEID or TEID continuity establishes the hop; a transport address alone does not identify an interface"
      ],
      "observation_window": {
        "end_frame": 14,
        "start_frame": 10
      },
      "primary_transaction": {
        "message_cause": {
          "cause_code": 16,
          "cause_name": "Request accepted",
          "scope": "message"
        },
        "outcome": "RESPONSE_ACCEPTED_OBSERVED",
        "procedure_family": "delete-session",
        "request_frame": 10,
        "response_frame": 14,
        "transaction_reference": "gtpv2-delete-session-10-26"
      },
      "procedure_families": [
        "delete-session"
      ],
      "procedure_local_deviation_count": 1,
      "procedure_local_deviations": [
        {
          "deviation_type": "INTERFACE_EVIDENCE_UNAVAILABLE",
          "evidence_level": "OBSERVED",
          "evidence_refs": [
            {
              "evidence_level": "OBSERVED",
              "frame_number": 10,
              "message_type": "Delete Session Request",
              "message_type_code": 36,
              "protocol": "GTPv2-C"
            },
            {
              "evidence_level": "OBSERVED",
              "frame_number": 14,
              "message_type": "Delete Session Response",
              "message_type_code": 37,
              "protocol": "GTPv2-C"
            }
          ],
          "explanation": "the control-plane hop of this transaction is not established by reviewed evidence",
          "frame_number": 14,
          "limitations": [
            "no reviewed control-plane F-TEID or TEID continuity establishes the hop; a transport address alone does not identify an interface"
          ],
          "message_type": "Delete Session Response",
          "observation_window": {
            "end_frame": 14,
            "start_frame": 10
          },
          "procedure_family": "delete-session",
          "protocol": "GTPv2-C",
          "transaction_reference": "gtpv2-delete-session-10-26"
        }
      ],
      "procedure_local_deviations_omitted": 0,
      "procedure_observations": {
        "delete-session": {
          "outcomes": [
            "RESPONSE_ACCEPTED_OBSERVED"
          ],
          "procedure_label": "Delete Session",
          "transaction_count": 1,
          "transactions": [
            {
              "_endpoints": {
                "request_destination": {
                  "address": "127.0.0.3",
                  "port": 2123
                },
                "request_source": {
                  "address": "127.0.0.2",
                  "port": 2123
                }
              },
              "_tokens": [],
              "bearer_contexts": [],
              "correlation_status": "MATCHED",
              "correlation_strength": "STRONG",
              "evidence_refs": [
                {
                  "evidence_level": "OBSERVED",
                  "frame_number": 10,
                  "message_type": "Delete Session Request",
                  "message_type_code": 36,
                  "protocol": "GTPv2-C"
                },
                {
                  "evidence_level": "OBSERVED",
                  "frame_number": 14,
                  "message_type": "Delete Session Response",
                  "message_type_code": 37,
                  "protocol": "GTPv2-C"
                }
              ],
              "f_teids": [],
              "interface_evidence": {
                "basis": "unavailable",
                "evidence_message": null,
                "interface": "UNKNOWN_INTERFACE",
                "supporting_frames": [],
                "supporting_interface_types": []
              },
              "limitations": [
                "no reviewed control-plane F-TEID or TEID continuity establishes the hop; a transport address alone does not identify an interface"
              ],
              "message_cause": {
                "cause_code": 16,
                "cause_name": "Request accepted",
                "scope": "message"
              },
              "observation_window": {
                "end_frame": 14,
                "start_frame": 10
              },
              "observations": [
                "REQUEST_OBSERVED",
                "RESPONSE_ACCEPTED_OBSERVED"
              ],
              "outcome": "RESPONSE_ACCEPTED_OBSERVED",
              "procedure_family": "delete-session",
              "procedure_label": "Delete Session",
              "request": {
                "evidence_level": "OBSERVED",
                "frame_number": 10,
                "message_type": "Delete Session Request",
                "message_type_code": 36,
                "protocol": "GTPv2-C"
              },
              "response": {
                "evidence_level": "OBSERVED",
                "frame_number": 14,
                "message_type": "Delete Session Response",
                "message_type_code": 37,
                "protocol": "GTPv2-C"
              },
              "transaction_reference": "gtpv2-delete-session-10-26"
            }
          ],
          "transactions_omitted": 0
        }
      },
      "subject_reference": "epc-session-unknown-186aa44d",
      "subject_type": "EPC_SESSION_CONTROL",
      "transaction_references": [
        "gtpv2-delete-session-10-26"
      ]
    },
    {
      "association_strength": "UNBOUND",
      "attach_association": "NOT_ESTABLISHED",
      "bearer_contexts": [],
      "capture_file": "corenet-epc-integrated.pcap",
      "control_plane_teids": [],
      "cross_interface_association": "NOT_ESTABLISHED",
      "endpoint_pair": "127.0.0.3:2123->127.0.0.34:2123",
      "evidence_refs": [
        {
          "evidence_level": "OBSERVED",
          "frame_number": 11,
          "message_type": "Delete Session Request",
          "message_type_code": 36,
          "protocol": "GTPv2-C"
        },
        {
          "evidence_level": "OBSERVED",
          "frame_number": 13,